{
  "apiVersion": "runtime.ai.ecosystem/v1alpha1",
  "kind": "PolicyDecision",
  "metadata": {
    "createdAt": "2026-07-15T12:57:39.014366Z",
    "id": "m2-live-policy-gate-decision",
    "runId": "m2-live-policy-gate-run"
  },
  "spec": {
    "constraints": {
      "expiresAt": "2026-07-15T13:02:39.014366Z",
      "singleUse": true
    },
    "effect": "allow",
    "policySnapshot": {
      "apiVersion": "ai.ecosystem/v1alpha1",
      "contractProfile": "runtime-contracts-v1alpha1",
      "digestProfile": "eco-python-json-v1",
      "policyEngineVersion": "0.1.0",
      "schemaBundleDigest": "4e4adc61b9c4ab32049a651a6d8749f3abb739c08c81d8cd5f233ed6a4f41aa0",
      "semanticConfigDigest": "74f72b4c9760fe355ffa98286d2f8fa5a46f9d6e3be0a76c6dfe08020859481a"
    },
    "reasonCodes": [
      "ECO_RUN_ALLOWED"
    ],
    "subject": {
      "digest": "74045aa667aaf5a7b0865a2ebe66ed801cbae4ad9a65af7e7977291c80ee0c94",
      "id": "m2-live-policy-gate-plan",
      "kind": "RunPlan"
    }
  }
}
